{
  "$schema": "../schema/svhape.schema.json",
  "schemaVersion": "0.1.0",
  "packageVersion": "0.1.0",
  "generatorVersion": "0.1.0",
  "shapeCount": 18,
  "shapes": [
    {
      "id": "cloud-frame",
      "name": "Cloud Frame",
      "family": "blob",
      "description": "Generous rounded billows around a content-safe center.",
      "className": "svhape--cloud-frame",
      "tags": [
        "capacity:standard",
        "cloud",
        "container",
        "family:blob",
        "playful",
        "soft",
        "use:callout",
        "use:card",
        "use:panel"
      ],
      "recommendedFor": [
        "celebrations",
        "friendly CTAs",
        "kids content"
      ],
      "selection": {
        "uses": [
          "callout",
          "card",
          "panel"
        ],
        "aspect": {
          "min": 1,
          "preferred": 1.5,
          "max": 2.5
        },
        "contentCapacity": "standard",
        "symmetry": "none",
        "balance": "centered",
        "edgeActivity": "active",
        "safeInset": {
          "top": 12,
          "right": 12,
          "bottom": 12,
          "left": 12
        }
      },
      "geometry": {
        "kind": "closed-catmull-rom",
        "anchorCount": 38,
        "anchors": [
          [
            6.4,
            6.4
          ],
          [
            14.327,
            3.6
          ],
          [
            23.84,
            9.2
          ],
          [
            31.767,
            4.3
          ],
          [
            41.28,
            8.5
          ],
          [
            49.207,
            3.6
          ],
          [
            58.72,
            9.2
          ],
          [
            66.647,
            4.3
          ],
          [
            76.16,
            8.5
          ],
          [
            84.087,
            3.6
          ],
          [
            93.6,
            6.4
          ],
          [
            96.15,
            16.309
          ],
          [
            91.05,
            28.2
          ],
          [
            95.512,
            38.109
          ],
          [
            91.688,
            50
          ],
          [
            96.15,
            59.909
          ],
          [
            91.05,
            71.8
          ],
          [
            95.512,
            81.709
          ],
          [
            93.6,
            93.6
          ],
          [
            86.994,
            95.775
          ],
          [
            79.067,
            91.425
          ],
          [
            72.461,
            96.5
          ],
          [
            64.533,
            90.7
          ],
          [
            57.927,
            95.775
          ],
          [
            50,
            91.425
          ],
          [
            43.394,
            96.5
          ],
          [
            35.467,
            90.7
          ],
          [
            28.861,
            95.775
          ],
          [
            20.933,
            91.425
          ],
          [
            14.327,
            96.5
          ],
          [
            6.4,
            93.6
          ],
          [
            3.95,
            83.691
          ],
          [
            8.85,
            71.8
          ],
          [
            4.563,
            61.891
          ],
          [
            8.238,
            50
          ],
          [
            3.95,
            40.091
          ],
          [
            8.85,
            28.2
          ],
          [
            4.563,
            18.291
          ]
        ],
        "closed": true,
        "continuity": "c1",
        "tension": 0,
        "precision": 3,
        "cssShape": "shape(from 6.4% 6.4%, curve to 14.327% 3.6% with 8.027% 3.952% / 11.42% 3.133%, curve to 23.84% 9.2% with 17.234% 4.067% / 20.933% 9.083%, curve to 31.767% 4.3% with 26.747% 9.317% / 28.86% 4.417%, curve to 41.28% 8.5% with 34.674% 4.183% / 38.373% 8.617%, curve to 49.207% 3.6% with 44.187% 8.383% / 46.3% 3.483%, curve to 58.72% 9.2% with 52.114% 3.717% / 55.813% 9.083%, curve to 66.647% 4.3% with 61.627% 9.317% / 63.74% 4.417%, curve to 76.16% 8.5% with 69.554% 4.183% / 73.253% 8.617%, curve to 84.087% 3.6% with 79.067% 8.383% / 81.18% 3.95%, curve to 93.6% 6.4% with 86.994% 3.25% / 91.589% 4.282%, curve to 96.15% 16.309% with 95.611% 8.518% / 96.575% 12.676%, curve to 91.05% 28.2% with 95.725% 19.942% / 91.156% 24.567%, curve to 95.512% 38.109% with 90.944% 31.833% / 95.406% 34.476%, curve to 91.688% 50% with 95.618% 41.742% / 91.582% 46.367%, curve to 96.15% 59.909% with 91.794% 53.633% / 96.256% 56.276%, curve to 91.05% 71.8% with 96.044% 63.542% / 91.156% 68.167%, curve to 95.512% 81.709% with 90.944% 75.433% / 95.087% 78.076%, curve to 93.6% 93.6% with 95.937% 85.342% / 95.02% 91.256%, curve to 86.994% 95.775% with 92.18% 95.944% / 89.416% 96.138%, curve to 79.067% 91.425% with 84.572% 95.413% / 81.489% 91.304%, curve to 72.461% 96.5% with 76.645% 91.546% / 74.883% 96.621%, curve to 64.533% 90.7% with 70.039% 96.379% / 66.955% 90.821%, curve to 57.927% 95.775% with 62.111% 90.579% / 60.349% 95.654%, curve to 50% 91.425% with 55.505% 95.896% / 52.422% 91.304%, curve to 43.394% 96.5% with 47.578% 91.546% / 45.816% 96.621%, curve to 35.467% 90.7% with 40.972% 96.379% / 37.889% 90.821%, curve to 28.861% 95.775% with 33.045% 90.579% / 31.283% 95.654%, curve to 20.933% 91.425% with 26.439% 95.896% / 23.355% 91.304%, curve to 14.327% 96.5% with 18.511% 91.546% / 16.749% 96.138%, curve to 6.4% 93.6% with 11.905% 96.863% / 8.13% 95.735%, curve to 3.95% 83.691% with 4.671% 91.465% / 3.542% 87.324%, curve to 8.85% 71.8% with 4.358% 80.058% / 8.748% 75.433%, curve to 4.563% 61.891% with 8.952% 68.167% / 4.665% 65.524%, curve to 8.238% 50% with 4.461% 58.258% / 8.34% 53.633%, curve to 3.95% 40.091% with 8.136% 46.367% / 3.848% 43.724%, curve to 8.85% 28.2% with 4.052% 36.458% / 8.748% 31.833%, curve to 4.563% 18.291% with 8.952% 24.567% / 4.971% 21.924%, curve to 6.4% 6.4% with 4.155% 14.658% / 4.773% 8.849%, close)",
        "sourceDigest": "sha256-e1fdd56a986533e9c69270b43d6229a6c0da2d7d368b3f4e3b2c256da85799d1"
      },
      "fallback": {
        "borderRadius": "40px"
      },
      "snippets": {
        "html": "<div class=\"svhape-shadow\">\n  <div class=\"svhape svhape--cloud-frame svhape--padded\">\n    Your content\n  </div>\n</div>",
        "selector": ".svhape.svhape--cloud-frame",
        "standaloneCss": ".svhape--cloud-frame {\n  border-radius: 40px;\n  overflow: hidden;\n}\n\n.svhape--cloud-frame.svhape--padded {\n  padding: 12%;\n}\n\n@supports (clip-path: shape(from 0 0, line to 100% 0, line to 100% 100%, close)) {\n  .svhape--cloud-frame {\n    border-radius: 0;\n    clip-path: shape(from 6.4% 6.4%, curve to 14.327% 3.6% with 8.027% 3.952% / 11.42% 3.133%, curve to 23.84% 9.2% with 17.234% 4.067% / 20.933% 9.083%, curve to 31.767% 4.3% with 26.747% 9.317% / 28.86% 4.417%, curve to 41.28% 8.5% with 34.674% 4.183% / 38.373% 8.617%, curve to 49.207% 3.6% with 44.187% 8.383% / 46.3% 3.483%, curve to 58.72% 9.2% with 52.114% 3.717% / 55.813% 9.083%, curve to 66.647% 4.3% with 61.627% 9.317% / 63.74% 4.417%, curve to 76.16% 8.5% with 69.554% 4.183% / 73.253% 8.617%, curve to 84.087% 3.6% with 79.067% 8.383% / 81.18% 3.95%, curve to 93.6% 6.4% with 86.994% 3.25% / 91.589% 4.282%, curve to 96.15% 16.309% with 95.611% 8.518% / 96.575% 12.676%, curve to 91.05% 28.2% with 95.725% 19.942% / 91.156% 24.567%, curve to 95.512% 38.109% with 90.944% 31.833% / 95.406% 34.476%, curve to 91.688% 50% with 95.618% 41.742% / 91.582% 46.367%, curve to 96.15% 59.909% with 91.794% 53.633% / 96.256% 56.276%, curve to 91.05% 71.8% with 96.044% 63.542% / 91.156% 68.167%, curve to 95.512% 81.709% with 90.944% 75.433% / 95.087% 78.076%, curve to 93.6% 93.6% with 95.937% 85.342% / 95.02% 91.256%, curve to 86.994% 95.775% with 92.18% 95.944% / 89.416% 96.138%, curve to 79.067% 91.425% with 84.572% 95.413% / 81.489% 91.304%, curve to 72.461% 96.5% with 76.645% 91.546% / 74.883% 96.621%, curve to 64.533% 90.7% with 70.039% 96.379% / 66.955% 90.821%, curve to 57.927% 95.775% with 62.111% 90.579% / 60.349% 95.654%, curve to 50% 91.425% with 55.505% 95.896% / 52.422% 91.304%, curve to 43.394% 96.5% with 47.578% 91.546% / 45.816% 96.621%, curve to 35.467% 90.7% with 40.972% 96.379% / 37.889% 90.821%, curve to 28.861% 95.775% with 33.045% 90.579% / 31.283% 95.654%, curve to 20.933% 91.425% with 26.439% 95.896% / 23.355% 91.304%, curve to 14.327% 96.5% with 18.511% 91.546% / 16.749% 96.138%, curve to 6.4% 93.6% with 11.905% 96.863% / 8.13% 95.735%, curve to 3.95% 83.691% with 4.671% 91.465% / 3.542% 87.324%, curve to 8.85% 71.8% with 4.358% 80.058% / 8.748% 75.433%, curve to 4.563% 61.891% with 8.952% 68.167% / 4.665% 65.524%, curve to 8.238% 50% with 4.461% 58.258% / 8.34% 53.633%, curve to 3.95% 40.091% with 8.136% 46.367% / 3.848% 43.724%, curve to 8.85% 28.2% with 4.052% 36.458% / 8.748% 31.833%, curve to 4.563% 18.291% with 8.952% 24.567% / 4.971% 21.924%, curve to 6.4% 6.4% with 4.155% 14.658% / 4.773% 8.849%, close);\n  }\n}"
      },
      "agent": {
        "shapeId": "cloud-frame",
        "stylesheet": "https://cdn.jsdelivr.net/gh/storypixel/svhapes@v0.1.0/dist/svhapes.css",
        "classes": [
          "svhape",
          "svhape--cloud-frame"
        ],
        "optionalClasses": [
          "svhape--padded",
          "svhape--desktop-only"
        ],
        "optionalWrapperClass": "svhape-shadow",
        "html": "<div class=\"svhape-shadow\">\n  <div class=\"svhape svhape--cloud-frame svhape--padded\">\n    Your content\n  </div>\n</div>",
        "selection": {
          "uses": [
            "callout",
            "card",
            "panel"
          ],
          "aspect": {
            "min": 1,
            "preferred": 1.5,
            "max": 2.5
          },
          "contentCapacity": "standard",
          "symmetry": "none",